{"artifactType":"nature-spatial-index","cellCount":1,"cells":[{"cellId":"8/21/74","entityCount":2,"packages":[{"bytes":236806,"contentHash":"sha256:c23aca411a38550930b9d45f89ff4f839b42e7d000d8a0b45c222287df57d902","entityCount":2,"shardCount":1,"shardIndex":0,"url":"assets/data/nature/spatial/cells/8/21/74/c23aca411a385509.json"}],"x":21,"y":74,"zoom":8}],"contentHash":"sha256:8a63b90488ae497cf61f231b52c948145af6204b1c9e1468aa246793513d9579","generated":true,"packageCount":1,"schemaVersion":"1.0.0","zoom":8}
